context.span_id,name,span_kind,parent_id,start_time,end_time,status_code,status_message,events,context.span_id.1,context.trace_id,attributes.output.value,attributes.input.mime_type,attributes.llm.token_count.total,attributes.llm.model_name,attributes.llm.output_messages,attributes.llm.token_count.prompt,attributes.llm.invocation_parameters,attributes.openinference.span.kind,attributes.llm.token_count.completion,attributes.input.value,attributes.output.mime_type,attributes.llm.input_messages
629e76b5d82b7b27,Completions,LLM,,2025-03-28 18:50:22.750373+00:00,2025-03-28 18:50:24.972192+00:00,OK,,[],629e76b5d82b7b27,f799668543330f89742ad53ef01d0d6d,"{""id"":""chatcmpl-8099108a-b9b6-4e12-9ac2-5219d7a29346"",""choices"":[{""finish_reason"":""stop"",""index"":0,""logprobs"":null,""message"":{""content"":""Low-latency Large Language Models (LLMs) are crucial in various applications where real-time or near-real-time processing is essential. Here are some reasons why low-latency LLMs are important:\n\n1. **Conversational AI**: In conversational AI, such as chatbots, virtual assistants, and dialogue systems, low-latency LLMs enable rapid responses to user inputs, creating a more natural and engaging user experience.\n2. **Real-time Language Translation**: Low-latency LLMs can facilitate simultaneous language translation, enabling real-time communication across language barriers. This is particularly important in fields like international business, diplomacy, and healthcare.\n3. **Speech Recognition**: Fast and accurate speech recognition relies on low-latency LLMs. This enables applications like voice-controlled interfaces, voice assistants, and transcription services to provide timely and accurate responses.\n4. **Content Generation**: Low-latency LLMs can generate content, such as text summaries or product descriptions, in real-time, which is essential for applications like content marketing, news aggregation, and e-commerce.\n5. **Question Answering**: Fast and accurate question answering systems rely on low-latency LLMs, enabling applications like customer support chatbots, knowledge bases, and voice assistants to provide quick and relevant answers.\n6. **Autonomous Systems**: In autonomous systems, such as self-driving cars or robots, low-latency LLMs can enable rapid processing of natural language inputs, allowing for swift decision-making and response to changing environments.\n7. **Healthcare**: In healthcare, low-latency LLMs can facilitate real-time language processing for applications like clinical decision support systems, medical transcription, and patient-provider communication.\n8. **Gaming and Interactive Systems**: Fast and responsive LLMs can enhance gaming experiences, enable real-time feedback, and provide more realistic NPC interactions.\n9. **Edge Computing**: With the proliferation of edge computing, low-latency LLMs can be deployed closer to the source of the data, reducing latency and enabling real-time processing for applications like autonomous vehicles, smart homes, and industrial automation.\n10. **Improving User Experience**: Low-latency LLMs can significantly improve user experience by providing rapid responses, reducing wait times, and enabling more natural interactions.\n\nTo achieve low latency, LLMs often employ various techniques, such as:\n\n1. **Model pruning**: Reducing the model's size and complexity while preserving its accuracy.\n2. **Knowledge distillation**: Transferring knowledge from a larger, pre-trained model to a smaller, faster model.\n3. **Quantization**: Representing model weights and activations using fewer bits, reducing memory usage and computation time.\n4. **Efficient inference**: Optimizing the inference process using techniques like batch processing, parallelization, and GPU acceleration.\n5. **Specialized hardware**: Utilizing hardware accelerators, such as TPUs or GPUs, designed specifically for fast and efficient processing of LLMs.\n\nBy minimizing latency, low-latency LLMs can unlock new use cases, improve user experiences, and drive innovation in various fields."",""role"":""assistant""}}],""created"":1743187823,""model"":""llama3-70b-8192"",""object"":""chat.completion"",""system_fingerprint"":""fp_2e0feca3c9"",""usage"":{""completion_tokens"":624,""prompt_tokens"":20,""total_tokens"":644,""completion_time"":1.8306197229999999,""prompt_time"":0.000259588,""queue_time"":0.059492851,""total_time"":1.830879311},""usage_breakdown"":{""models"":null},""x_groq"":{""id"":""req_01jqf1ejdcet2s3ra6pe0pqdam""}}",application/json,644,llama3-70b-8192,"[{'message.role': 'assistant', 'message.content': ""Low-latency Large Language Models (LLMs) are crucial in various applications where real-time or near-real-time processing is essential. Here are some reasons why low-latency LLMs are important:\n\n1. **Conversational AI**: In conversational AI, such as chatbots, virtual assistants, and dialogue systems, low-latency LLMs enable rapid responses to user inputs, creating a more natural and engaging user experience.\n2. **Real-time Language Translation**: Low-latency LLMs can facilitate simultaneous language translation, enabling real-time communication across language barriers. This is particularly important in fields like international business, diplomacy, and healthcare.\n3. **Speech Recognition**: Fast and accurate speech recognition relies on low-latency LLMs. This enables applications like voice-controlled interfaces, voice assistants, and transcription services to provide timely and accurate responses.\n4. **Content Generation**: Low-latency LLMs can generate content, such as text summaries or product descriptions, in real-time, which is essential for applications like content marketing, news aggregation, and e-commerce.\n5. **Question Answering**: Fast and accurate question answering systems rely on low-latency LLMs, enabling applications like customer support chatbots, knowledge bases, and voice assistants to provide quick and relevant answers.\n6. **Autonomous Systems**: In autonomous systems, such as self-driving cars or robots, low-latency LLMs can enable rapid processing of natural language inputs, allowing for swift decision-making and response to changing environments.\n7. **Healthcare**: In healthcare, low-latency LLMs can facilitate real-time language processing for applications like clinical decision support systems, medical transcription, and patient-provider communication.\n8. **Gaming and Interactive Systems**: Fast and responsive LLMs can enhance gaming experiences, enable real-time feedback, and provide more realistic NPC interactions.\n9. **Edge Computing**: With the proliferation of edge computing, low-latency LLMs can be deployed closer to the source of the data, reducing latency and enabling real-time processing for applications like autonomous vehicles, smart homes, and industrial automation.\n10. **Improving User Experience**: Low-latency LLMs can significantly improve user experience by providing rapid responses, reducing wait times, and enabling more natural interactions.\n\nTo achieve low latency, LLMs often employ various techniques, such as:\n\n1. **Model pruning**: Reducing the model's size and complexity while preserving its accuracy.\n2. **Knowledge distillation**: Transferring knowledge from a larger, pre-trained model to a smaller, faster model.\n3. **Quantization**: Representing model weights and activations using fewer bits, reducing memory usage and computation time.\n4. **Efficient inference**: Optimizing the inference process using techniques like batch processing, parallelization, and GPU acceleration.\n5. **Specialized hardware**: Utilizing hardware accelerators, such as TPUs or GPUs, designed specifically for fast and efficient processing of LLMs.\n\nBy minimizing latency, low-latency LLMs can unlock new use cases, improve user experiences, and drive innovation in various fields.""}]",20,"{""model"": ""llama3-70b-8192""}",LLM,624,"{""messages"": [{""role"": ""user"", ""content"": ""Explain the importance of low latency LLMs""}], ""model"": ""llama3-70b-8192""}",application/json,"[{'message.role': 'user', 'message.content': 'Explain the importance of low latency LLMs'}]"
962a901d2b7f2e3b,Completions,LLM,,2025-03-28 18:50:24.980602+00:00,2025-03-28 18:50:26.832192+00:00,OK,,[],962a901d2b7f2e3b,1ac860242c63da7a26f4973ce44ae2e9,"{""id"":""chatcmpl-1debd819-c054-44ef-b948-d73735c84a79"",""choices"":[{""finish_reason"":""stop"",""index"":0,""logprobs"":null,""message"":{""content"":""Arize Phoenix is an open-source, cloud-agnostic machine learning (ML) observability platform that helps data scientists, engineers, and ML practitioners to monitor, explain, and improve their machine learning models in production. Here's why you should consider using Arize Phoenix:\n\n**Key Features:**\n\n1. **Model performance monitoring**: Track your model's performance in real-time, including metrics like accuracy, precision, recall, and F1 score.\n2. **Data quality monitoring**: Identify data quality issues, such as data drift, data skew, and anomalies, that can affect model performance.\n3. **Model explainability**: Use techniques like SHAP values, partial dependence plots, and feature importance to understand how your model is making predictions.\n4. **Error analysis**: Identify errors and biases in your model's predictions, and get insights on how to improve them.\n5. **Collaboration and versioning**: Collaborate with your team on model development, and version your models to track changes and improvements.\n\n**Why use Arize Phoenix?**\n\n1. **Improve model performance**: By monitoring performance and identifying issues, you can optimize your model to make better predictions and improve overall business outcomes.\n2. **Reduce model risk**: Identify and mitigate risks associated with model deployment, such as bias, drift, and errors, to ensure fairness, transparency, and accountability.\n3. **Accelerate model development**: Collaborative features and versioning help streamline the model development process, reducing the time and effort required to develop and deploy models.\n4. **Increase transparency and explainability**: Arize Phoenix provides insights into model behavior, enabling organizations to provide transparent and explainable AI solutions that comply with regulations.\n5. **Cost-effective and scalable**: As an open-source platform, Arize Phoenix offers a cost-effective solution for ML observability, and its cloud-agnostic design allows it to scale with your organization's needs.\n\n**Who should use Arize Phoenix?**\n\nArize Phoenix is designed for data scientists, machine learning engineers, and teams working on artificial intelligence and machine learning projects. It's particularly useful for organizations that:\n\n1. Have deployed machine learning models in production.\n2. Need to ensure model fairness, transparency, and accountability.\n3. Want to improve model performance and reduce errors.\n4. Are looking for a cost-effective and scalable ML observability solution.\n\nBy using Arize Phoenix, you can ensure that your machine learning models are accurate, fair, and reliable, which is essential for building trust in AI systems."",""role"":""assistant""}}],""created"":1743187825,""model"":""llama3-70b-8192"",""object"":""chat.completion"",""system_fingerprint"":""fp_2e0feca3c9"",""usage"":{""completion_tokens"":506,""prompt_tokens"":22,""total_tokens"":528,""completion_time"":1.677690065,""prompt_time"":0.000336437,""queue_time"":0.054118862,""total_time"":1.678026502},""usage_breakdown"":{""models"":null},""x_groq"":{""id"":""req_01jqf1eme2et3a9k96t7r7yx3n""}}",application/json,528,llama3-70b-8192,"[{'message.role': 'assistant', 'message.content': ""Arize Phoenix is an open-source, cloud-agnostic machine learning (ML) observability platform that helps data scientists, engineers, and ML practitioners to monitor, explain, and improve their machine learning models in production. Here's why you should consider using Arize Phoenix:\n\n**Key Features:**\n\n1. **Model performance monitoring**: Track your model's performance in real-time, including metrics like accuracy, precision, recall, and F1 score.\n2. **Data quality monitoring**: Identify data quality issues, such as data drift, data skew, and anomalies, that can affect model performance.\n3. **Model explainability**: Use techniques like SHAP values, partial dependence plots, and feature importance to understand how your model is making predictions.\n4. **Error analysis**: Identify errors and biases in your model's predictions, and get insights on how to improve them.\n5. **Collaboration and versioning**: Collaborate with your team on model development, and version your models to track changes and improvements.\n\n**Why use Arize Phoenix?**\n\n1. **Improve model performance**: By monitoring performance and identifying issues, you can optimize your model to make better predictions and improve overall business outcomes.\n2. **Reduce model risk**: Identify and mitigate risks associated with model deployment, such as bias, drift, and errors, to ensure fairness, transparency, and accountability.\n3. **Accelerate model development**: Collaborative features and versioning help streamline the model development process, reducing the time and effort required to develop and deploy models.\n4. **Increase transparency and explainability**: Arize Phoenix provides insights into model behavior, enabling organizations to provide transparent and explainable AI solutions that comply with regulations.\n5. **Cost-effective and scalable**: As an open-source platform, Arize Phoenix offers a cost-effective solution for ML observability, and its cloud-agnostic design allows it to scale with your organization's needs.\n\n**Who should use Arize Phoenix?**\n\nArize Phoenix is designed for data scientists, machine learning engineers, and teams working on artificial intelligence and machine learning projects. It's particularly useful for organizations that:\n\n1. Have deployed machine learning models in production.\n2. Need to ensure model fairness, transparency, and accountability.\n3. Want to improve model performance and reduce errors.\n4. Are looking for a cost-effective and scalable ML observability solution.\n\nBy using Arize Phoenix, you can ensure that your machine learning models are accurate, fair, and reliable, which is essential for building trust in AI systems.""}]",22,"{""model"": ""llama3-70b-8192""}",LLM,506,"{""messages"": [{""role"": ""user"", ""content"": ""What is Arize Phoenix and why should I use it?""}], ""model"": ""llama3-70b-8192""}",application/json,"[{'message.role': 'user', 'message.content': 'What is Arize Phoenix and why should I use it?'}]"
56c43ccf643b841a,Completions,LLM,,2025-03-28 18:50:26.838059+00:00,2025-03-28 18:50:29.108674+00:00,OK,,[],56c43ccf643b841a,f82bfb8547fb6a6492f77af51d5a7a36,"{""id"":""chatcmpl-2135ffad-054a-46b4-b0d7-c4b24cf3bee6"",""choices"":[{""finish_reason"":""stop"",""index"":0,""logprobs"":null,""message"":{""content"":""Groq is an interesting new player in the object storage market, and its pricing model is designed to be competitive with Amazon S3. While both services have their own pricing structures and nuances, I'll break down the costs to help you compare them.\n\n**Groq Pricing:**\n\nGroq uses a simple, usage-based pricing model:\n\n* Storage: $0.004 per GB-month (approximately $4 per TB-month)\n* Bandwidth: $0.005 per GB (outbound data transfer)\n* Requests: $0.000004 per request (GET, PUT, LIST, etc.)\n\n**Amazon S3 Pricing:**\n\nAmazon S3 uses a more complex pricing structure, with different tiers for storage, requests, and data transfer:\n\n* Storage:\n\t+ Standard: $0.023 per GB-month (approximately $23 per TB-month)\n\t+ Infrequent Access (IA): $0.0125 per GB-month (approximately $12.50 per TB-month)\n\t+ Archive: $0.004 per GB-month (approximately $4 per TB-month)\n* Requests:\n\t+ GET, LIST: $0.004 per 10,000 requests\n\t+ PUT, COPY, POST, DELETE: $0.005 per 10,000 requests\n* Data Transfer:\n\t+ Outbound data transfer: $0.09 per GB (first 10 TB), decreasing to $0.05 per GB (next 40 TB), and then $0.025 per GB (over 50 TB)\n\n**Comparison:**\n\nBased on the pricing models, here are some observations:\n\n* **Storage:** Groq is generally cheaper than Amazon S3 Standard storage, especially for larger storage needs. However, if you can use S3 Infrequent Access or Archive storage, the prices are more comparable.\n* **Bandwidth:** Groq's outbound data transfer pricing is more competitive than S3's, especially for large datasets.\n* **Requests:** Groq's request pricing is simpler and potentially more cost-effective than S3's request pricing, especially for a large number of requests.\n\n**When Groq might be less expensive:**\n\n* If you have a large amount of storage needs (e.g., hundreds of TBs) and can take advantage of Groq's simple pricing model.\n* If you have a high volume of outbound data transfer.\n* If you have a large number of requests (e.g., a high-traffic website or application).\n\n**When Amazon S3 might be less expensive:**\n\n* If you can use S3 Infrequent Access or Archive storage, which can be cheaper than Groq for less frequently accessed data.\n* If you have a small to moderate amount of storage needs (e.g., tens of TBs).\n* If you're already invested in the AWS ecosystem and can take advantage of S3's integration with other AWS services.\n\nUltimately, the choice between Groq and Amazon S3 depends on your specific use case, storage needs, and bandwidth requirements. I recommend carefully evaluating your usage patterns and estimating costs based on your specific use case before making a decision."",""role"":""assistant""}}],""created"":1743187827,""model"":""llama3-70b-8192"",""object"":""chat.completion"",""system_fingerprint"":""fp_2e0feca3c9"",""usage"":{""completion_tokens"":626,""prompt_tokens"":22,""total_tokens"":648,""completion_time"":2.060437443,""prompt_time"":0.000329178,""queue_time"":0.056015771,""total_time"":2.060766621},""usage_breakdown"":{""models"":null},""x_groq"":{""id"":""req_01jqf1ep86et3t43meengrfdyd""}}",application/json,648,llama3-70b-8192,"[{'message.role': 'assistant', 'message.content': ""Groq is an interesting new player in the object storage market, and its pricing model is designed to be competitive with Amazon S3. While both services have their own pricing structures and nuances, I'll break down the costs to help you compare them.\n\n**Groq Pricing:**\n\nGroq uses a simple, usage-based pricing model:\n\n* Storage: $0.004 per GB-month (approximately $4 per TB-month)\n* Bandwidth: $0.005 per GB (outbound data transfer)\n* Requests: $0.000004 per request (GET, PUT, LIST, etc.)\n\n**Amazon S3 Pricing:**\n\nAmazon S3 uses a more complex pricing structure, with different tiers for storage, requests, and data transfer:\n\n* Storage:\n\t+ Standard: $0.023 per GB-month (approximately $23 per TB-month)\n\t+ Infrequent Access (IA): $0.0125 per GB-month (approximately $12.50 per TB-month)\n\t+ Archive: $0.004 per GB-month (approximately $4 per TB-month)\n* Requests:\n\t+ GET, LIST: $0.004 per 10,000 requests\n\t+ PUT, COPY, POST, DELETE: $0.005 per 10,000 requests\n* Data Transfer:\n\t+ Outbound data transfer: $0.09 per GB (first 10 TB), decreasing to $0.05 per GB (next 40 TB), and then $0.025 per GB (over 50 TB)\n\n**Comparison:**\n\nBased on the pricing models, here are some observations:\n\n* **Storage:** Groq is generally cheaper than Amazon S3 Standard storage, especially for larger storage needs. However, if you can use S3 Infrequent Access or Archive storage, the prices are more comparable.\n* **Bandwidth:** Groq's outbound data transfer pricing is more competitive than S3's, especially for large datasets.\n* **Requests:** Groq's request pricing is simpler and potentially more cost-effective than S3's request pricing, especially for a large number of requests.\n\n**When Groq might be less expensive:**\n\n* If you have a large amount of storage needs (e.g., hundreds of TBs) and can take advantage of Groq's simple pricing model.\n* If you have a high volume of outbound data transfer.\n* If you have a large number of requests (e.g., a high-traffic website or application).\n\n**When Amazon S3 might be less expensive:**\n\n* If you can use S3 Infrequent Access or Archive storage, which can be cheaper than Groq for less frequently accessed data.\n* If you have a small to moderate amount of storage needs (e.g., tens of TBs).\n* If you're already invested in the AWS ecosystem and can take advantage of S3's integration with other AWS services.\n\nUltimately, the choice between Groq and Amazon S3 depends on your specific use case, storage needs, and bandwidth requirements. I recommend carefully evaluating your usage patterns and estimating costs based on your specific use case before making a decision.""}]",22,"{""model"": ""llama3-70b-8192""}",LLM,626,"{""messages"": [{""role"": ""user"", ""content"": ""Is Groq less expensive than hosting on Amazon S3?""}], ""model"": ""llama3-70b-8192""}",application/json,"[{'message.role': 'user', 'message.content': 'Is Groq less expensive than hosting on Amazon S3?'}]"
